user_input,output,flag,username,timestamp
hello,Hello! How can I assist you today regarding real estate investment or negotiation?,,,2023-10-26 15:49:14.791260
I am mike,"Hello, Mike! How can I help you with your real estate investment or negotiation needs?",,,2023-10-26 15:51:13.278998
I am mike,"Hello, Mike! How can I help you with your real estate investment or negotiation needs?",,,2023-10-26 15:51:17.422363
what is a goal?,"A goal is an objective or target that an individual or organization aims to achieve. It is a desired outcome or result that guides and motivates actions and decisions. Goals provide focus, direction, and purpose by defining what needs to be accomplished within a specific timeframe. They can be short-term or long-term and can be related to various aspects of life, such as personal development, career advancement, health and fitness, financial stability, or business growth. Setting clear and measurable goals is important to track progress and stay motivated in the pursuit of success.",,,2023-10-31 20:27:16.201738
azubi,azubi program,,,2023-10-31 20:31:11.912941
